{
  "$schema": "https://json-schema.org/draft/2020-12/schema",
  "$id": "https://noortrace.example/schemas/v0/instance-registre.schema.json",
  "title": "Manifeste d'une instance du registre, version 0 (CT-4 §4.8)",
  "description": "Ce que l'exploitant d'une instance de noorcore publie, hors des dossiers, pour les clients, les opérateurs de validateurs et les réviseurs : identifiants, document de genèse et ligne de règles, version de noorcore et correctifs (par leur nom et leur empreinte, jamais leur contenu), jeux de validateurs avec leurs hauteurs de validité, règle de frais, contrats avec leurs transactions de déploiement et les preuves capturées de leurs blocs, comptes de l'exploitant. Tout y est déclaratif : les vérifications RG-16 à RG-20 de CT-4 recalculent ce qui se recalcule, le reste se recoupe (CT-6 §12.5). Clés en anglais, valeurs énumérées en français sans accent, hexadécimal en minuscules (CT-1 §3).",
  "type": "object",
  "additionalProperties": false,
  "required": [
    "version",
    "revision",
    "previous_sha256",
    "published_at",
    "nature",
    "bft_chain_id",
    "evm_chain_id",
    "evm_chain_id_registration",
    "genesis",
    "noorcore",
    "validator_sets",
    "fees",
    "contracts",
    "compilation",
    "accounts",
    "source"
  ],
  "properties": {
    "version": { "const": 0 },
    "revision": {
      "type": "integer",
      "minimum": 1,
      "maximum": 9007199254740991,
      "description": "Numéro de révision du manifeste, croissant de 1 en 1 à partir de 1 (EX-4.25)."
    },
    "previous_sha256": {
      "oneOf": [ { "type": "null" }, { "$ref": "#/$defs/hex32" } ],
      "description": "SHA-256 des octets du fichier de la révision précédente ; null pour la révision 1 (RG-16)."
    },
    "published_at": { "$ref": "#/$defs/horodatage" },
    "nature": { "enum": [ "developpement", "production" ], "description": "Mêmes valeurs que recorder.environment de CT-2 §15." },
    "bft_chain_id": {
      "type": "string",
      "pattern": "^noortrace-[1-9][0-9]{0,9}-[a-z0-9]{1,16}$",
      "description": "Identifiant de chaîne BFT (-chain-id, rules.chainId) : domaine de chaque enveloppe signée par les validateurs (CT-6 EX-11.7), registry.chain_id du fichier d'ancres de CT-6 (RG-20). Le nombre qu'il contient est evm_chain_id (EX-4.6, RG-17)."
    },
    "evm_chain_id": {
      "type": "integer",
      "minimum": 1,
      "maximum": 2147483647,
      "description": "Identifiant EVM (eth_chainId, EIP-155), lié à chaque transaction et à chaque condensé des contrats (block.chainid)."
    },
    "evm_chain_id_registration": {
      "type": "object",
      "additionalProperties": false,
      "required": [ "status", "checked_at", "source" ],
      "properties": {
        "status": {
          "enum": [ "inscrit", "absent", "attribue_a_un_tiers" ],
          "description": "État de l'identifiant EVM dans le registre public ethereum-lists/chains à la date de consultation (EX-4.7)."
        },
        "checked_at": { "$ref": "#/$defs/horodatage" },
        "source": { "$ref": "#/$defs/texte" }
      }
    },
    "genesis": {
      "type": "object",
      "additionalProperties": false,
      "required": [ "file", "sha256", "rules_line", "alloc_total_wei" ],
      "properties": {
        "file": { "$ref": "#/$defs/chemin" },
        "sha256": { "$ref": "#/$defs/hex32", "description": "SHA-256 des octets du document de genèse publié (RG-17)." },
        "rules_line": {
          "type": "string",
          "minLength": 1,
          "maxLength": 512,
          "description": "Ligne de règles canonique que le nœud journalise après « genesis rules: verified against … | » (EX-4.3, RG-17)."
        },
        "alloc_total_wei": {
          "$ref": "#/$defs/decimal",
          "description": "Somme des soldes de genèse, en wei, écrite en décimal : l'offre totale de NUR de l'instance, qui ne peut que baisser (4.5)."
        }
      }
    },
    "noorcore": {
      "type": "object",
      "additionalProperties": false,
      "required": [ "repository", "commit", "go_version", "patches", "artifacts" ],
      "properties": {
        "repository": { "type": "string", "pattern": "^https://[^\\s]{1,200}$" },
        "commit": { "type": "string", "pattern": "^[0-9a-f]{40}$" },
        "go_version": { "type": "string", "pattern": "^[0-9]{1,3}\\.[0-9]{1,3}(\\.[0-9]{1,3})?$" },
        "patches": {
          "type": "array",
          "maxItems": 16,
          "items": { "$ref": "#/$defs/correctif" },
          "description": "Correctifs appliqués dans l'ordre de leurs noms, désignés par leur nom et leur empreinte ; leur contenu n'est jamais publié (EX-4.23)."
        },
        "artifacts": { "type": "array", "minItems": 1, "maxItems": 16, "items": { "$ref": "#/$defs/artefact" } }
      }
    },
    "validator_sets": {
      "type": "array",
      "minItems": 1,
      "maxItems": 16,
      "items": { "$ref": "#/$defs/jeu_publie" },
      "description": "Jeux de validateurs avec leurs hauteurs de validité. Les quatre premiers membres de chaque entrée ont la forme exacte d'un jeu du fichier d'ancres de CT-6 (§12.2, $defs/jeu_validateurs) ; RG-20 en dérive registry.validator_sets."
    },
    "fees": {
      "type": "object",
      "additionalProperties": false,
      "required": [ "transaction_type", "max_fee_per_gas_wei", "max_priority_fee_per_gas_wei", "gas_limit", "gas_limit_max", "provision_days", "refill_below_days" ],
      "properties": {
        "transaction_type": { "const": 2 },
        "max_fee_per_gas_wei": { "const": "1" },
        "max_priority_fee_per_gas_wei": { "const": "1" },
        "gas_limit": { "type": "integer", "minimum": 1000000, "maximum": 16777216, "description": "Limite de gaz de chaque transaction des outils (EX-4.17)." },
        "gas_limit_max": { "const": 16777216 },
        "provision_days": { "type": "integer", "minimum": 1, "maximum": 366 },
        "refill_below_days": { "type": "integer", "minimum": 1, "maximum": 366 },
        "max_daily_budget_gas": { "oneOf": [ { "type": "null" }, { "type": "integer", "minimum": 1, "maximum": 9007199254740991 } ], "description": "Plafond du budget journalier b_k qu'un approvisionnement peut retenir (EX-8.20) ; facultatif, nul : aucun plafond." }
      }
    },
    "contracts": {
      "type": "array",
      "minItems": 4,
      "maxItems": 16,
      "items": { "$ref": "#/$defs/contrat" },
      "allOf": [
        { "contains": { "type": "object", "properties": { "name": { "const": "AttestationRegistry" } } } },
        { "contains": { "type": "object", "properties": { "name": { "const": "CuratorSetRegistry" } } } },
        { "contains": { "type": "object", "properties": { "name": { "const": "PeriodRegistry" } } } },
        { "contains": { "type": "object", "properties": { "name": { "const": "RecorderRegistry" } } } }
      ]
    },
    "compilation": {
      "type": "object",
      "additionalProperties": false,
      "required": [ "solc", "via_ir", "optimizer_runs", "source_commit" ],
      "properties": {
        "solc": { "type": "string", "pattern": "^[0-9]{1,2}\\.[0-9]{1,2}\\.[0-9]{1,3}$" },
        "via_ir": { "type": "boolean" },
        "optimizer_runs": { "type": "integer", "minimum": 0, "maximum": 4294967295 },
        "source_commit": {
          "oneOf": [ { "type": "null" }, { "type": "string", "pattern": "^[0-9a-f]{40}$" } ],
          "description": "Commit du dépôt NOORTRACE dont contracts/ a été compilé pour le déploiement ; null si aucun commit n'est établi (EX-5.8)."
        }
      }
    },
    "accounts": {
      "type": "array",
      "minItems": 1,
      "maxItems": 64,
      "items": { "$ref": "#/$defs/compte" },
      "description": "Comptes de l'exploitant, par rôle, avec leurs hauteurs de validité (EX-3.1, 5.5)."
    },
    "source": { "$ref": "#/$defs/texte" }
  },
  "$defs": {
    "texte": { "type": "string", "minLength": 1, "maxLength": 512 },
    "chemin": {
      "type": "string",
      "pattern": "^[A-Za-z0-9._-][A-Za-z0-9._/-]{0,255}$",
      "description": "Chemin relatif d'un fichier publié avec le manifeste, ou dans le dépôt public."
    },
    "hex32": { "type": "string", "pattern": "^0x[0-9a-f]{64}$" },
    "adresse": { "type": "string", "pattern": "^0x[0-9a-f]{40}$" },
    "decimal": { "type": "string", "pattern": "^(0|[1-9][0-9]{0,77})$" },
    "hauteur": { "type": "integer", "minimum": 0, "maximum": 9007199254740991 },
    "horodatage": {
      "type": "string",
      "pattern": "^[0-9]{4}-(0[1-9]|1[0-2])-(0[1-9]|[12][0-9]|3[01])T([01][0-9]|2[0-3]):[0-5][0-9]:[0-5][0-9]\\.[0-9]{3}Z$",
      "description": "RFC 3339, UTC, trois décimales, suffixe Z (CT-1 §3) ; la date doit exister."
    },
    "fichier": {
      "type": "object",
      "additionalProperties": false,
      "required": [ "file", "sha256" ],
      "properties": { "file": { "$ref": "#/$defs/chemin" }, "sha256": { "$ref": "#/$defs/hex32" } }
    },
    "correctif": {
      "type": "object",
      "additionalProperties": false,
      "required": [ "name", "sha256", "effect" ],
      "properties": {
        "name": { "type": "string", "pattern": "^[0-9]{4}-[A-Za-z0-9._-]{1,96}\\.patch$" },
        "sha256": { "$ref": "#/$defs/hex32" },
        "effect": { "$ref": "#/$defs/texte" }
      }
    },
    "artefact": {
      "type": "object",
      "additionalProperties": false,
      "required": [ "kind", "name", "sha256", "build" ],
      "properties": {
        "kind": { "enum": [ "binaire", "image" ] },
        "name": { "type": "string", "minLength": 1, "maxLength": 256 },
        "sha256": { "$ref": "#/$defs/hex32", "description": "SHA-256 du fichier binaire, ou condensé du manifeste de l'image conteneur." },
        "build": { "$ref": "#/$defs/texte" }
      }
    },
    "validateur": {
      "type": "object",
      "additionalProperties": false,
      "required": [ "id", "pubKeyHex" ],
      "properties": {
        "id": { "type": "string", "minLength": 1, "maxLength": 128 },
        "pubKeyHex": {
          "type": "string",
          "pattern": "^0x([0-9a-f]{66}|[0-9a-f]{128}|[0-9a-f]{130})$",
          "description": "Clé publique secp256k1 telle que validators.json la déclare ; le hachage du jeu porte sur ces octets (CT-6 EX-11.8)."
        }
      }
    },
    "operateur": {
      "type": "object",
      "additionalProperties": false,
      "required": [ "validator", "operator", "site", "retention_heights" ],
      "properties": {
        "validator": { "type": "string", "minLength": 1, "maxLength": 128 },
        "operator": { "type": "string", "minLength": 1, "maxLength": 128, "description": "Organisation qui exploite le validateur et détient sa clé." },
        "site": { "type": "string", "minLength": 1, "maxLength": 128, "description": "Domaine de panne : site, région ou machine ; jamais une adresse réseau." },
        "retention_heights": {
          "oneOf": [ { "type": "null" }, { "type": "integer", "minimum": 1, "maximum": 9007199254740991 } ],
          "description": "Rétention des certificats de commit déclarée par l'opérateur (NOOR_BFT_CERT_RETENTION_HEIGHTS) ; null si inconnue."
        }
      }
    },
    "jeu_publie": {
      "type": "object",
      "additionalProperties": false,
      "required": [ "from_height", "to_height", "validators", "source", "valset_hash", "operators" ],
      "properties": {
        "from_height": { "$ref": "#/$defs/hauteur" },
        "to_height": { "oneOf": [ { "type": "null" }, { "$ref": "#/$defs/hauteur" } ] },
        "validators": { "type": "array", "minItems": 4, "maxItems": 128, "items": { "$ref": "#/$defs/validateur" } },
        "source": { "$ref": "#/$defs/texte" },
        "valset_hash": { "$ref": "#/$defs/hex32", "description": "Hachage du jeu selon CT-6 EX-11.8, recalculé par RG-18." },
        "operators": { "type": "array", "minItems": 4, "maxItems": 128, "items": { "$ref": "#/$defs/operateur" } }
      }
    },
    "preuve_deploiement": {
      "type": "object",
      "additionalProperties": false,
      "required": [ "capture" ],
      "properties": {
        "capture": {
          "$ref": "#/$defs/fichier",
          "description": "Index de capture (CT-4 §9.4, operations-registre-v0, rôle deploiement) de la transaction de déploiement : en-tête, reçus de toutes les transactions du bloc et certificat de commit, capturés auprès d'un validateur avant l'élagage (EX-4.27)."
        }
      }
    },
    "contrat": {
      "type": "object",
      "additionalProperties": false,
      "required": [ "name", "address", "deployer", "nonce", "constructor_args", "transaction_hash", "block_number", "block_hash", "evidence", "to_height" ],
      "properties": {
        "name": { "enum": [ "AttestationRegistry", "CuratorSetRegistry", "PeriodRegistry", "RecorderRegistry" ] },
        "address": { "$ref": "#/$defs/adresse" },
        "deployer": { "$ref": "#/$defs/adresse" },
        "nonce": {
          "type": "integer",
          "minimum": 0,
          "maximum": 9007199254740991,
          "description": "Nonce du déployeur pour la transaction de création ; address = CREATE(deployer, nonce) (RG-19)."
        },
        "constructor_args": { "type": "array", "maxItems": 4, "items": { "$ref": "#/$defs/adresse" } },
        "transaction_hash": { "$ref": "#/$defs/hex32" },
        "block_number": { "type": "integer", "minimum": 1, "maximum": 9007199254740991 },
        "block_hash": {
          "oneOf": [ { "type": "null" }, { "$ref": "#/$defs/hex32" } ],
          "description": "null tant que le hachage du bloc n'est pas relevé ; non nul en production (RG-19, EX-4.28)."
        },
        "evidence": {
          "oneOf": [ { "type": "null" }, { "$ref": "#/$defs/preuve_deploiement" } ],
          "description": "null tant que la capture du bloc de déploiement n'est pas faite ; non nul en production (EX-4.27, EX-4.28)."
        },
        "to_height": {
          "oneOf": [ { "type": "null" }, { "$ref": "#/$defs/hauteur" } ],
          "description": "Hauteur après laquelle le contrat n'est plus en service (remplacé, EX-5.9) ; null s'il l'est."
        }
      }
    },
    "compte": {
      "type": "object",
      "additionalProperties": false,
      "required": [ "role", "address", "from_height", "to_height" ],
      "properties": {
        "role": { "enum": [ "tresorerie", "deployeur", "administrateur_registre", "relayeur" ] },
        "address": { "$ref": "#/$defs/adresse" },
        "from_height": { "$ref": "#/$defs/hauteur" },
        "to_height": { "oneOf": [ { "type": "null" }, { "$ref": "#/$defs/hauteur" } ] }
      }
    }
  }
}
